<?xml version="1.0" encoding="UTF-8"?>
<xs:schema xmlns:xs="http://www.w3.org/2001/XMLSchema">

    <xs:simpleType name="genreType">
        <xs:restriction base="xs:string">
            <xs:enumeration value="Роман"/>
            <xs:enumeration value="Фантастика"/>
            <xs:enumeration value="Детектив"/>
            <xs:enumeration value="Поэзия"/>
        </xs:restriction>
    </xs:simpleType>

    <xs:complexType name="bookType">
        <xs:sequence>
            <xs:element name="title" type="xs:string"/>
            <xs:element name="author" type="xs:string"/>
            <xs:element name="year">
                <xs:simpleType>
                    <xs:restriction base="xs:int">
                        <xs:minInclusive value="1500"/>
                        <xs:maxInclusive value="2025"/>
                    </xs:restriction>
                </xs:simpleType>
            </xs:element>
            <xs:element name="genre" type="genreType"/>
            <xs:element name="price">
                <xs:simpleType>
                    <xs:restriction base="xs:decimal">
                        <xs:minInclusive value="100"/>
                        <xs:maxInclusive value="10000"/>
                    </xs:restriction>
                </xs:simpleType>
            </xs:element>
        </xs:sequence>
        <xs:attribute name="id" type="xs:int" use="required"/>
    </xs:complexType>

    <xs:element name="library">
        <xs:complexType>
            <xs:sequence>
                <xs:element name="book" type="bookType" maxOccurs="unbounded"/>
            </xs:sequence>
        </xs:complexType>
    </xs:element>

</xs:schema>
