<?xml version="1.0" encoding="UTF-8"?>
<library xmlns:xsi="http://www.w3.org/2001/XMLSchema-instance" xsi:noNamespaceSchemaLocation="library.xsd">
    <book id="1">
        <title >Война и мир</title>
        <author>Лев Толстой</author>
        <year>1869</year>
        <genre>Роман</genre>
        <price>500</price>
    </book>
    <book id="2">
        <title>Преступление и наказание</title>
        <author>Федор Достоевский</author>
        <year>1866</year>
        <genre>Детектив</genre>
        <price>400</price>
    </book>
</library>
